result,idxs,citations,id
Crizotinib selectively inhibited the growth of ARID1A-deficient CRC cells in vitro and in xenograft tumor models.,"[6, 7, 8]","['colorectal cancer (CRC) cells induce synthetic lethality when treated with inhibitors of c-MET receptor tyrosine kinase. c-MET specific inhibitor PHA-665752 as well as two other FDA-approved drugs, crizotinib and cabozantinib, selectively inhibited the growth of ARID1A-deficient CRC cells in vitro and in xenograft tumor models. Mechanistically, we identified a tripartite functional association', 'colorectal cancer (CRC) cells induce synthetic lethality when treated with inhibitors of c-MET receptor tyrosine kinase. c-MET specific inhibitor PHA-665752 as well as two other FDA-approved drugs, crizotinib and cabozantinib, selectively inhibited the growth of ARID1A-deficient CRC cells in vitro and in xenograft tumor models. Mechanistically, we identified a tripartite functional association', 'colorectal cancer (CRC) cells induce synthetic lethality when treated with inhibitors of c-MET receptor tyrosine kinase. c-MET specific inhibitor PHA-665752 as well as two other FDA-approved drugs, crizotinib and cabozantinib, selectively inhibited the growth of ARID1A-deficient CRC cells in vitro and in xenograft tumor models. Mechanistically, we identified a tripartite functional association']",40369167
Crizotinib achieved a partial response with progression-free survival of 3 months in a metastatic colorectal carcinoma patient with ALK gene rearrangement.,"[1, 2, 5]","['In conclusion, we have reported on an elderly patient with ALK-fusion mCRC who was treated with crizotinib, alectinib, and lorlatinib and achieved PR with the PFS of 3, 0.5, and 11.5 months, respectively. The case provides a new potential treatment strategy for patients with CRC who did not respond to standard treatment with ALK rearrangement but still poses a few questions. Are there any other', 'In this report, we show the clinical efficacy of crizotinib, alectinib, and lorlatinib in an ALK-rearrangement mCRC with LM. This case had several uncommon features: the presence of ALK fusions that are rarely present in mCRC; the first report of a patient with ALK-rearranged mCRC who showed a good response to crizotinib, alectinib, and lorlatinib therapy; and the first case of ALK fusion', 'In this case study, we describe the first instance of ALK rearrangement in CRC detected using NGS of CSF ctDNA, as well as a case of lasting objective tumor response to crizotinib, alectinib, and lorlatinib therapy.\nCASE REPORT']",34036227
NP,[],[],35343863
Crizotinib restored cetuximab sensitivity in SC.,[1],"['monoclonal antibody, cetuximab, strongly inhibited growth of CC, whereas SC was resistant to growth inhibition, and this was coupled to increased tyrosine phosphorylation of MET and RON. Addition of the dual MET/RON tyrosine kinase inhibitor, crizotinib, restored cetuximab sensitivity in SC. To further characterize these two lines, we performed comprehensive genomic and transcriptomic analysis of']",28320945
NP,[],[],38212428
Limited activity in unselected heavily pre-treated patients with advanced solid tumours.,"[2, 3, 8]","['In summary, inhibition of the MEK1/2 and c-MET kinases using PD-0325901 and crizotinib, was well tolerated with a manageable toxicity profile, but with limited activity in unselected heavily pre-treated patients with advanced solid tumours. Further exploration of this combination in a biomarker selected population of patients with advanced CRC was not pursued due to the termination of the', 'In summary, inhibition of the MEK1/2 and c-MET kinases using PD-0325901 and crizotinib, was well tolerated with a manageable toxicity profile, but with limited activity in unselected heavily pre-treated patients with advanced solid tumours. Further exploration of this combination in a biomarker selected population of patients with advanced CRC was not pursued due to the termination of the', 'Single-agent MEK1/2 inhibition has been disappointing in clinical trials targeting RAS mutant (MT) cancers, probably due to upstream receptor activation, resulting in resistance. We previously found that dual c-MET/MEK1/2 inhibition attenuated RASMT colorectal cancer (CRC) xenograft growth. In this study, we assessed safety of MEK1/2 inhibitor PD-0325901 with c-MET inhibitor crizotinib and']",40140597
NP,[],[],31399568
(S)-crizotinib induces massive cell death in CRC spheroids and inhibits c-MET and ErbB3.,"[0, 7]","['(S)-crizotinib inhibits c-MET and ErbB3 in human CRC spheroids', 'p26 (Supplementary Fig.Â\xa0S1). Treating CRC spheroids with 20â\x80\x89Î¼M of TH588 could only reduce cell viability about 20% (Supplementary Fig.Â\xa0S1). In contrast, 20â\x80\x89Î¼M of (S)-crizotinib induced massive cell death (Supplementary Fig.Â\xa0S1). Given that 20â\x80\x89Î¼M of (S)-crizotinib induced massive cell death of CRC spheroids, we concluded that we should use a lower drug concentration during further']",30692572
EpAb2-6 improves the efficacy of crizotinib therapy in a colon cancer animal model,"[0, 1, 4]","['EpAb2-6 improves the efficacy of crizotinib therapy in a colon cancer animal model', 'EpAb2-6 improves the efficacy of crizotinib therapy in a colon cancer animal model', 'To determine whether EpAb2-6 improves the efficacy of crizotinib therapy in colon cancer animal model, we first examined the effect of crizotinib and EpAb2-6 in the colon cancer cell HCT116 metastasis model. As illustrated in Fig.Â\xa07C, NOD/SCID mice were injected intravenously with HCT116 cells and then co-treated with crizotinib and EpAb2-6, or an equivalent volume of control IgG, at 3Â\xa0days']",37543570
Crizotinib effectively sensitizes cetuximab-resistant KRAS mutant colorectal cancer cell lines to radiation.,[5],['crizotinib completely blocked HGF induced cell migration. CONCLUSIONS: Inhibition of c-Met with crizotinib effectively sensitizes cetuximab-resistant KRAS mutant colorectal cancer cell lines to radiation. Crizotinib has the potential to improve outcomes in locally advanced rectal cancer patients undergoing chemoradiation.'],30412912
Crizotinib plus vemurafenib showed rapid and marked effectiveness in treating BRAF-mutated colorectal cancer.,[4],"['functional in vitro data, the patient was treated with the dual ALK-MET inhibitor crizotinib plus vemurafenib, thus switching to dual MET and BRAF blockade, with rapid and marked effectiveness of such strategy. Although acquired resistance is a major limitation to the clinical efficacy of anticancer agents, the identification of molecular targets emerging during the first treatment may afford the']",27325282
Molecularly targeted treatment with crizotinib induced a rapid and sustained partial response.,"[3, 6]","['were found exclusively in microsatellite stable (MSS) CRCs. KRAS mutations were significantly less abundant in ROS1â\x80\x90rearranged vs ROS1 wild type cases. The index patient presented with chemotherapyâ\x80\x90refractory metastatic rightâ\x80\x90sided colon cancer harboring GOPCâ\x80\x90ROS1. Molecularly targeted treatment with crizotinib induced a rapid and sustained partial response. After 15â\x80\x89months on', 'treatment with crizotinib induced a rapid and sustained partial response. After 15â\x80\x89months on crizotinib disseminated tumor progression occurred and KRAS Q61H emerged in tissue and liquid biopsies. ROS1 rearrangements define a small, yet therapeutically actionable molecular subgroup of MSS CRC. In summary, the high prevalence of GOPCâ\x80\x90ROS1 and noncanonical ROS1 fusions pose diagnostic']",36053834
NP,[],[],36316649
"Crizotinib combined with regorafenib and tislelizumab obtained an obvious response in a CRC patient with BRAF V600E mutation, c-MET amplification, and TPM4-ALK fusion.","[6, 7, 8]","['This study reported a co-existence of a BRAF V600E mutation, c-MET amplification and TPM4-ALK fusion in a CRC patient. Administration of crizotinib combined with regorafenib and tislelizumab obtained an obvious response. Furthermore, continuous ctDNA detection appears to be a promising technique to monitor tumor burden, which may provide better clinical decision support during the disease course.', 'This study reported a co-existence of a BRAF V600E mutation, c-MET amplification and TPM4-ALK fusion in a CRC patient. Administration of crizotinib combined with regorafenib and tislelizumab obtained an obvious response. Furthermore, continuous ctDNA detection appears to be a promising technique to monitor tumor burden, which may provide better clinical decision support during the disease course.', 'In this study, we identified a rarely reported TPM4-ALK fusion co-occurring with MET amplification in a CRC patient with BRAF V600E mutation who achieved partial response (PR) after the combined therapy of programmed cell death protein 1 (PD-1) inhibitor (tislelizumab), MET/ALK inhibitor (crizotinib) plus multikinase inhibitor (regorafenib), and whose response was monitored by continuous ctDNA']",38711893
ORR was 50% with one complete response in the,"[0, 1]","['those with ALK mutation or amplifications. Results of subgroup F (cases harboring ALK fusions) of the NCI match study were recently reported as well. Two patients with colorectal cancer, one with carcinoma of unknown primary and one with leiomyosarcoma were included in this cohort and treated with crizotinib. At the time of analysis, the ORR was 50% with one complete response in the', 'those with ALK mutation or amplifications. Results of subgroup F (cases harboring ALK fusions) of the NCI match study were recently reported as well. Two patients with colorectal cancer, one with carcinoma of unknown primary and one with leiomyosarcoma were included in this cohort and treated with crizotinib. At the time of analysis, the ORR was 50% with one complete response in the']",37773318
The study assessed safety and initial efficacy of crizotinib in treating RAS mutant advanced colorectal cancer patients.,[9],['study assessed safety and initial efficacy of the MEK1/2 inhibitor binimetinib with MET inhibitor crizotinib in RASMT advanced CRC patients.'],40211189
The combination of crizotinib with MMC showed a synergistic anti-cancer effect (CI = 0.006-0.74) and reduced tumor growth (p = 0.0088) in CRC xenograft models.,"[1, 4]","['especially in MSI-H CRC. The combination of crizotinib with MMC appeared synergistic regardless of MSI or BRCA2 status. Using an in-vivo CRC xenograft model we found reduced tumor growth with combined crizotinib and MMC therapy (p = 0.0088). Our preclinical results support clinical testing of the combination of MMC and crizotinib in advanced CRC. Targeting cell survival mediated by c-MET in', 'to MMC plus crizotinib or other drug combinations including PARP-inhibitors. Combined treatment of tumor cells with crizotinib and MMC led to increased apoptosis as compared with each drug alone. Additionally, combination treatment with increasing concentrations of both drugs demonstrated a synergistic anti-cancer effect (CI = 0.006-0.74). However, we found no evidence for c-MET upregulation upon']",28886275
Crizotinib (CZB) impacts LoVo spheroids morphology.,[7],"['In this study, the LoVo colon cancer cell line forming spheroids was treated with crizotinib (CZB) an ATP-competitive small-molecule inhibitor of the receptor tyrosine kinases. This inhibitor, already been proved to impact LoVo spheroids morphology, was employed to assess the correlation between biophysical and morphological parameters in both live and fixed cells (Fig 1).\nMaterials and methods']",34101765
NP,[],[],41213063
Crizotinib showed a median PFS of 10.9 months and an ORR of 74% in treating colorectal cancer.,[2],['the median PFS (10.9 months with crizotinib vs. 7.0 months with standard chemotherapy) and increased the ORR (74% with crizotinib vs. 45% with standard chemotherapy).'],37686423
